{
  "errorCode": "errorCode",
  "callBackInfo": null,
  "success": false,
  "errorKind": "errorKind",
  "message": "message",
  "errorMessage": "errorMessage",
  "options": [
    {
      "id": "id",
      "name": "name",
      "cost": 0.0
    }
  ],
  "isVisible": false,
  "isRequired": false,
  "defaultValue": "defaultValue",
  "$schema": "./field-configuration-CallbackName.response.schema.json"
}